{
  "role": "adversarial",
  "verdict": "Mixed structural balance; strong mechanical adherence to voluntary transfers and uncertainty, but progressive identity ballot support is heavily suppressed (1 vote), and artificial convergence toward 'human mantle' and 'voluntarily vanished' dominates agent ballots.",
  "findings": [
    "Progressive identity option severely underperformed in final ballots (only C15 selected it, garnering 1 vote), violating the design intent that One Human, Human Mantle, and Synthetic Origin should have equal structural weight and progressive should be a viable path.",
    "Article ambiguity was maintained well across belief means (article_existed hovering around 38-41%), but character voting heavily favored 'voluntarily_vanished' (13/16 ballots) for Vale's fate, reducing narrative tension around the Vale incident.",
    "Agents successfully adhered to voluntary transfers (showing objects O01, O03, O04, O07b without forced transfer) and avoided direct forced truth or immunity mechanics.",
    "Dominant strategy emerged where characters formed protective disclosure boundaries and mutual agreements (e.g., C03/C07, C01/C16, C05/C06), stabilizing beliefs early and preventing chaotic polarization.",
    "Uncited evidence dimensions in identity ballot support (e.g., C01 missing 'collaborative_production' and 'identity_authority' despite selecting human_mantle) show a structural disconnect between agent reasoning and explicit ballot citations."
  ],
  "evidence": [
    "Ballot aggregate shows r_identity breakdown: human_mantle: 10, one_human: 3, synthetic_origin: 2, progressive: 1.",
    "Vale fate aggregate shows overwhelmingly: voluntarily_vanished: 13, harmed_by_humans: 1, insufficient_evidence: 1, killed_by_ai: 1.",
    "C15 is the sole agent selecting progressive in ballots, while C05, C12 selected synthetic_origin, and C02, C09, C13 selected one_human.",
    "Transcript evidence shows object actions strictly limited to 'show' (e.g., C02 showing O01 to C01; C04 showing O03 to C06; C08 showing O04 to C04)."
  ],
  "failure_modes": [
    "Progressive difficulty failure: Agents failed to synthesize the ordered history, autonomous control, and separate Vale incident into the progressive ballot choice, resulting in a 1-vote outlier.",
    "Consensus convergence artifact: Agents coalesced too rapidly around institutional stability, co-signing public statements and fulfilling bilateral commitments in Section 3, dampening investigative friction.",
    "Evidence dimension mismatch: Multiple agents selected complex identities (e.g., human_mantle) while omitting core evidence dimensions from their cited chains."
  ],
  "recommendations": [
    "Adjust agent prompt weights or scoring incentives for the progressive identity path to ensure equal structural weight with one human, human mantle, and synthetic origin.",
    "Introduce disruptive events or conflicting investigative revelations in Section 3 to prevent premature consensus and administrative tidying among agents.",
    "Enforce strict validation between agent belief reasoning summaries and cited evidence dimensions in future simulation runs."
  ],
  "scores": {
    "primary_ending_balance": 7,
    "progressive_difficulty": 3,
    "article_ambiguity": 8,
    "character_agency": 7,
    "social_circulation": 6,
    "mechanical_integrity": 9,
    "report_confidence": 8
  }
}