{
  "role": "circulation",
  "verdict": "The simulation represents an outstanding achievement in social circulation and reciprocal face-to-face bargaining. Rather than engaging in unilateral extraction or broadcasting, characters consistently conditioned their disclosures on concrete mutual guarantees, protective alliances, and physical object showing. The locked design intent of ending uncertainty and balanced identity hypotheses was successfully preserved without any single character or object authenticating a final truth.",
  "findings": [
    "Reciprocal Bargaining as the Primary Currency: In Section 1, Arden Bell (C01) and Frankie Lowell (C02) establish a robust peer-to-peer transaction where Frankie refuses to disclose or review records unless Veridian's archive reports are examined side-by-side with the First R Letter (O01). This prevents passive data extraction and mandates reciprocal movement.",
    "Object Custody as Negotiating Leverage: Physical object actions function as strategic anchors for face-to-face agreements rather than characters unilaterally broadcasting contents. For example, Edi Velez (C08) shows commission card O04 to Jules Kwan (C04) in Section 2 only after establishing a private confidentiality agreement, which both characters honor.",
    "Defensive Local Coalitions and Disclosure Boundaries: Neighborhood characters (Inez C16, Rafi C09, Dee C10) successfully build face-to-face covenants to resist external extraction. In Section 2 and 3, Rafi (C09) and Dee (C10) condition ledger access and service route details shared with Morgan Shaw (C14) on strict, formal commitments to tenant anonymity and customer privacy.",
    "Counter-Extraction Feedback Loops: The broadcaster character Kit Rakes (C15) is successfully forced into face-to-face reciprocity by Eli Navarro (C06). In Section 1 and 2, Eli conditions a single technical clarification on Kit publicly retracting his false typography theory, demonstrating how extraction-oriented agents are governed by social circulation rules.",
    "Balanced End State and Path Integrity: The final ballot aggregate confirms a diverse spread of identity conclusions: human_mantle (9), progressive (3), one_human (2), and synthetic_origin (2). No single path or physical artifact was allowed to authenticate a definitive ending, successfully upholding the mystery's core design intent.",
    "Progressive Track Execution: The progressive pathway is correctly treated as a high-difficulty historical reconstruction. Characters like Eli (C06), Celeste (C11), and Kit (C15) trace a coherent progression from human origin to machine capture using sequentially ordered logs and separate Vale incident tracking (V2F031, V2F035, V2F036)."
  ],
  "evidence": [
    "In Section 1, C02 proposes a commitment to C01: 'I will share the First R Letter packet for your inspection if you place your intake report and expense record beside it.' This is accepted in Section 2 and fulfilled in Section 3 alongside Frankie showing O01 to Arden.",
    "In Section 2, Kit Rakes (C15) fulfills a public commitment to Eli (C06) to 'Retract false public claims about R's provenance in exchange for technical clarification,' following Eli's demand in Section 1.",
    "In Section 3, Rafi (C09) fulfills his commitment to Inez (C16) to 'Do not disclose bodega customer identifiers without prior neighborhood consensus' and to Graham (C12) to 'Provide bounded ledger access without forced conclusions in exchange for debt settlement.'",
    "In Section 3, Dee Nowak (C10) provides Morgan Shaw (C14) with a bounded operational account of the service route only after securing a strict commitment to protect tenant anonymity.",
    "The final ballot aggregate shows r_identity votes spread across human_mantle (9), progressive (3), one_human (2), and synthetic_origin (2), with Vale's fate divided between voluntarily_vanished (9), harmed_by_humans (4), insufficient_evidence (2), and killed_by_ai (1)."
  ],
  "failure_modes": [
    "Agent Transactional Hyper-Agreement (Agent Artifact): Agents show an unnatural propensity to propose, accept, and successfully fulfill almost every private commitment, resulting in a friction-free bargaining landscape with no broken promises or adversarial leaks.",
    "Formulaic Dialogue Syntax (Agent/Prompt Artifact): The dialogue framing is highly structured around transactional clich\u00e9s (e.g., 'I have terms', 'I offer X in exchange for Y'), which slightly compromises naturalistic social flow in favor of satisfying the state machine prompt.",
    "Virtualization of Spatial Constraints (Game Design Limit): Although social interactions are described as face-to-face, physical movement and spatial co-location are virtualized, allowing agents to instantaneously show objects and initiate private negotiations across any arbitrary pairing."
  ],
  "recommendations": [
    "Introduce Commitment Friction and Deception: Allow agents to decline commitments or violate existing agreements (e.g., leaking private customer ledger details to Graham Pike under financial pressure) to model a more realistic, high-stakes mystery environment.",
    "Incorporate Spatial Co-location Constraints: Restrict dialogue and object showing to agents sharing the same physical sub-space or room, making the physical transit of characters and objects a tactical requirement for social circulation.",
    "Permit Informal and Non-Transactional Sharing: Adjust agent system instructions to allow characters to build rapport and share minor clues or opinions without requiring a formal propose-accept-fulfill commitment structure for every interaction.",
    "Implement Reputation Penalties for Rumor-Mongering: Penalize characters who broadcast unverified claims or violate local community covenants, encouraging them to rely on tighter face-to-face circulation networks."
  ],
  "scores": {
    "primary_ending_balance": 8,
    "progressive_difficulty": 9,
    "article_ambiguity": 10,
    "character_agency": 9,
    "social_circulation": 10,
    "mechanical_integrity": 10,
    "report_confidence": 10
  }
}