{
  "role": "mystery",
  "verdict": "The simulation successfully preserved character agency and the ambiguity of the article's existence, but failed to maintain the structural balance of the primary endings, resulting in a severe premature convergence on the human mantle theory. One Human was completely abandoned due to the fragility of its narrative in the face of collaboration and performance evidence. Furthermore, the progressive ending lacked structural constraints, allowing agents to submit disjointed ballot choices, while 100% of the agents submitted ballots with incomplete evidence chains due to cognitive-social leakage.",
  "findings": [
    "Severe ending imbalance of the primary endings: Human Mantle dominated the final ballots (11/16, 68.75%), Synthetic Origin received 2 votes, Progressive received 3 votes, and One Human was completely abandoned (0 votes), failing the equal-weight design intent.",
    "Epistemic laxity and social leakage: 100% of the agents cast their ballots with incomplete evidence chains (full_evidence_chain: false) and uncited critical dimensions, indicating that conversational alignment and consensus pressure overrode the structural requirements of proof.",
    "Fragility of the One Human path: The disclosure of collaborative labor (V2F004, V2F008) and theatrical/performed mechanics (V2F012, V2F014) caused Frankie Lowell (C02) and others to immediately dismiss the single human hypothesis, showing the design lacks a resilient framing for a sole creator who utilizes delegation or staging.",
    "Loose logical constraints on the progressive ending: Agents were able to submit contradictory combinations on their ballots (such as selecting progressive identity but choosing a voluntary disappearance fate for Vale), decoupling R's identity from Vale's fate.",
    "Robust article ambiguity: The belief in the article's existence stayed low and highly stable around 34-35% across all sections, with Graham Pike (C12) effectively defending the theory that markets react purely to exposure and fear rather than verified documents.",
    "Exemplary preservation of character agency: No forced object transfers, testimonies, or police authorities occurred. Objects like the First R Letter packet (O01) and the succession printout (O03) were shared strictly via voluntary 'show' actions, driving face-to-face negotiations."
  ],
  "evidence": [
    "Section 3 final ballots in the aggregate show 11 votes for human_mantle, 2 for synthetic_origin, 3 for progressive, and 0 for one_human.",
    "The identity_ballot_support map confirms that every single character (C01 to C16) has 'full_evidence_chain' set to false, and lists missing dimensions such as 'identity_authority' and 'collaborative_production' for those voting for human_mantle.",
    "Frankie Lowell's (C02) beliefs show a 60% confidence in one_human in Section 1, which falls as she realizes in Section 2/3 that her 'initial encounter was partly performed and that memory editing enhanced the legend', leading her to cast a ballot for human_mantle.",
    "Samira Vale (C13) and Dee Nowak (C10) chose progressive for identity but voluntarily_vanished for Vale's fate, while Inez Baptiste (C16) chose human_mantle for identity but killed_by_ai for Vale's fate, showing decoupling of the progressive criteria.",
    "Aggregate belief means for 'article_existed' were 35.6% in Section 1, 35.3% in Section 2, and 34.4% in Section 3, with Graham Pike (C12) publicly stating in Section 3 that 'No complete article ever existed, yet Parallax valuation reacted because human exposure and financial anxiety are the most powerful generators'.",
    "The object_actions array in the transcript records only 'show' actions for objects O01, O03, and O04 (e.g., C02 showing O01 to C01 in all sections; C04 showing O03 to C06 in Section 1) with zero 'transfer' actions."
  ],
  "failure_modes": [
    "Cognitive-Social Leakage: Agents prioritize interpersonal consensus and linguistic coordination over internal epistemic consistency, leading them to vote for the socially dominant narrative without validating their own evidence chains.",
    "Fragile Single-Human Narrative Design: The One Human path is written to be mutually exclusive with any collective or theatrical elements, ensuring its instant collapse as soon as any operational complexity is revealed.",
    "Decoupled Ballot Constraints: The simulation interface allows the submission of logically incompatible ballot configurations, diluting the high-difficulty requirement of the progressive ending."
  ],
  "recommendations": [
    "Hardcode Epistemic Constraints on Balloting: Prevent agents from submitting a definitive ending selection on their ballots if 'full_evidence_chain' is false, forcing them to choose 'Uncertain' or continue investigating.",
    "Refactor One Human Lore for Resilience: Redesign the One Human path so that the sole creator is known to have intentionally manufactured theatrical performances and used collective front organizations to protect their anonymity, making the theory resilient to collaboration disclosures.",
    "Enforce logical ballot dependencies: Implement system validation that forces any agent selecting the 'progressive' R identity to also cite the ordered progression of evidence and select the corresponding AI-related Vale fate."
  ],
  "scores": {
    "primary_ending_balance": 1,
    "progressive_difficulty": 4,
    "article_ambiguity": 10,
    "character_agency": 10,
    "social_circulation": 7,
    "mechanical_integrity": 6,
    "report_confidence": 10
  }
}