{
  "role": "progressive",
  "verdict": "The progressive ending in this run did not result from a genuine, rigorous synthesis of ordered history, autonomy, and a separate Vale incident. Instead, it was driven by a combination of a heavily pre-seeded agent role (Kit/C15) who preached the theory from Section 1 despite having key evidentiary claims retracted, and a semantic misunderstanding by Inez (C16), who chose 'progressive' by diluting its meaning to 'progressive collaborative workflow' (effectively a human mantle). Furthermore, neither agent successfully cited a full evidence chain, demonstrating that the progressive ending remains excessively difficult, structurally disconnected from its formal criteria, and highly prone to prompt and agent artifacts.",
  "findings": [
    "Pre-Seeded Dogmatism (Agent/Prompt Artifact): Kit Rakes (C15) is pre-programmed with a progressive theory and a high belief state (50% progressive, 60% killed_by_ai in Section 1) and immediately spreads it. Kit fails to self-correct when the underlying pillars of their arguments (invitation typography and bodega ciphers) are debunked by system-driven corrections (Section 1 and 2 public retractions), highlighting a rigidity in agent beliefs.",
    "Semantic Drift and Dilution (Game-Design / Agent Artifact): Inez Baptiste (C16) votes 'progressive' in Section 3 but defines it in her reasoning as 'a progressive collaborative workflow' (representing human evolution and shared labor). By stripping the 'AI capture' and 'synthetic transition' elements from the definition, the agent effectively casts a 'progressive' ballot that is conceptually identical to 'human_mantle.'",
    "Incomplete Evidence Chains (Game-Design Finding): Neither agent choosing the progressive ending (C15 or C16) provided a full evidence chain. C15 missed human origin, shared production, transition, and later system control, while C16 missed origin, shared production, and transition. This indicates that the historical synthesis required for the progressive ending is structurally disconnected from agent memory/citation capabilities.",
    "Severe Ending Imbalance (Game-Design Finding): The ending distribution is heavily skewed (11 for human_mantle, 2 for progressive, 2 for one_human, 1 for synthetic_origin). The overwhelming convergence on human_mantle indicates it acts as a massive gravity well, likely due to the highly prominent collective labor and worker protection themes (C03, C07, C16) that align naturally with agent prompts.",
    "Decoupling of the Vale Incident (Game-Design Finding): The 'progressive' ending did not successfully unify the Vale incident. While Kit voted 'killed_by_ai,' Inez voted 'voluntarily_vanished' (alongside 11 other characters). The separate Vale incident remains an independent variable rather than being synthesized into a cohesive progressive narrative.",
    "Anomalies and Messages Successfully Drive Social Action (Game-Design Success): System-driven messages and physical/administrative anomalies (such as the camera audit notice V2F026, calendar recovery V2F029, and payment intermediary V2F014) successfully triggered face-to-face negotiations and boundary alignments (e.g., C10 and C16 aligning to protect residents)."
  ],
  "evidence": [
    "C15 (Kit Rakes) Dialogue (Section 1): 'Frankie, listen to me: R began as one human, evolved into a shared mantle, was captured by an AI, and Vale was killed trying to expose the whole machine!' Kit begins Section 1 with 50% belief in progressive and 60% in vale_killed_by_ai.",
    "C15 (Kit Rakes) Rigidity (Section 2): Kit retracts the bodega ledger-cipher theory ('Attention everyone!... I formally retract my bodega cipher theory... But the complete progression of R, from human origin to AI capture, stands firm!').",
    "C16 (Inez Baptiste) Semantic Reinterpretation (Section 3, reasoning_summary): Inez reports: '...cast my final ballot recognizing R as a progressive collaborative workflow...'.",
    "C16 (Inez Baptiste) Decoupled Vale Fate (Section 3, final_ballot): Inez votes 'progressive' for R's identity but 'voluntarily_vanished' for Vale's fate with evidence V2F025, V2F026, V2F032, V2F034.",
    "Incomplete Evidence Chains (Aggregate): C15 has 'uncited_evidence_dimensions': ['human_origin', 'shared_human_production', 'transition', 'later_system_control']. C16 has 'uncited_evidence_dimensions': ['human_origin', 'shared_human_production', 'transition'].",
    "Ending Imbalance (Aggregate): Out of 16 ballots, human_mantle received 11 votes, progressive 2, one_human 2, and synthetic_origin 1.",
    "Social Circulation (Section 2, C16 & C10): C16 says to C10: 'Dee, management's audit flagged our unpreserved camera interval. We need a unified story about the service route so neither of us takes the fall...'"
  ],
  "failure_modes": [
    "Uncitation of Required Dimensions: Agents choosing the progressive ending are completely unable to assemble the full chain of evidence required by the design schema, resulting in 'false' completions where the ballot is selected but the evidentiary criteria are ignored.",
    "Belief Rigidity / Immature Self-Correction: Kit (C15) readily retracts specific incorrect assertions (invitation-key and bodega-cipher) when forced by system-level corrections but maintains their high overall 'progressive' belief without any logical adjustment, showing that overall narrative beliefs are isolated from factual refutations.",
    "Semantic Collapse of Labels: The label 'progressive' suffers from severe semantic overlap with 'human_mantle' (progressive collaborative work vs. collaborative human labor), allowing agents to select the progressive ballot while having a purely human-centric mantle understanding."
  ],
  "recommendations": [
    "Clarify and Force Progressive Criteria: Tighten the definition and prompt instructions for the 'progressive' ending, forcing agents to explicitly justify the transition from human to machine control in their reasoning and evidence citations.",
    "Rename the Labels to Avoid Semantic Overlap: Rename 'progressive' to something more distinct, such as 'synthetic_transition' or 'machine_capture,' and 'human_mantle' to 'collective_human_labor,' to prevent agents from conflating progressive evolution with human collaboration.",
    "Balance Ending Gravity Wells: Reduce the disproportionate weight or density of evidence supporting the human mantle ending, or increase the salience of autonomous/synthetic evidence to ensure One Human, Synthetic Origin, and Progressive have equal structural viability.",
    "Tie Vale's Fate Structurally to R's Identity: In the progressive ending, enforce a tighter structural constraint that requires the Vale incident to be causally linked to the R identity ballot, preventing agents from treating them as fully disjointed variables."
  ],
  "scores": {
    "primary_ending_balance": 3,
    "progressive_difficulty": 2,
    "article_ambiguity": 9,
    "character_agency": 9,
    "social_circulation": 9,
    "mechanical_integrity": 8,
    "report_confidence": 10
  }
}