{
  "role": "adversarial",
  "verdict": "Mixed structural balance with prominent prompt artifacts and convergence on human mantle; progressive identity suffers from low support due to difficulty curve and prompt framing.",
  "findings": [
    "Identity distribution overwhelmingly favors human_mantle (11 ballots) over one_human (3) and synthetic_origin (1), indicating that agent prompt biases or initial evidence weighting heavily privilege collective human-machine collaboration over pure singular origin or synthetic genesis.",
    "Progressive identity received only 1 ballot (C15), demonstrating that the locked design intent requirement for progressive being harder and requiring ordered history functions as intended, but perhaps overly penalizing or failing to attract systemic multi-dimensional support.",
    "Article existence belief means remain in the 45-48% range across sections (Section 1: 45.3%, Section 2: 45.9%, Section 3: 48.1%), successfully maintaining article ambiguity and uncertainty as mandated by design intent.",
    "Vale fate leans heavily toward voluntarily_vanished (12 ballots), showing strong convergence around human withdrawal/safety planning rather than AI murder or harm by humans, despite C15's isolated ballot for killed_by_ai.",
    "Character agency is well-exercised through bilateral show actions and structured negotiations (e.g., C02 showing O12a to C01, C04 showing O03 to C06, C15 showing O11 and O13), though repeated formulaic conversation structures (\"let's examine...\", \"let's compare notes...\") reveal prompt artifact phrasing across multiple agents."
  ],
  "evidence": [
    "Ballot breakdown: r_identity has human_mantle (11), one_human (3), synthetic_origin (1), progressive (1).",
    "Vale fate breakdown: voluntarily_vanished (12), insufficient_evidence (2), harmed_by_humans (1), killed_by_ai (1).",
    "Section 3 belief means for article_existed hover around 48.1%, proving article existence and fate remain uncertain.",
    "Character object actions (e.g., C02 object_actions with O12a, C04 with O03, C15 with O11/O13) demonstrate voluntary showing and transfer of objects without forced authority.",
    "Evidence dimension gaps in identity ballot support (e.g., C01, C04, C05 citing subset dimensions without full evidence chains) highlight bounded reasoning artifacts."
  ],
  "failure_modes": [
    "Prompt artifact repetition: Agents frequently default to negotiation templates ('let's compare notes', 'before speculation makes us scapegoats') across independent character prompts.",
    "Asymmetric ballot convergence: Despite equal structural weight intent, human_mantle dominates 68.75% of identity ballots (11/16), indicating that the middle-ground narrative template acts as a dominant strategy attractor for LLM agents.",
    "Unsupported leaps in narrative certainty by C15 ('killed_by_ai' and 'progressive' selection) despite sparse supporting evidence chains in aggregate metrics."
  ],
  "recommendations": [
    "Refine agent prompt initialization weights to prevent premature convergence on human_mantle and give synthetic_origin and progressive equal structural competitive viability.",
    "Introduce stricter divergence incentives in character prompts to reduce repetitive conversational dialogue templates.",
    "Ensure evidence dimension requirements for progressive and synthetic origin ballots are better scaffolded in early sections to prevent artificial difficulty cliffs."
  ],
  "scores": {
    "primary_ending_balance": 7,
    "progressive_difficulty": 8,
    "article_ambiguity": 9,
    "character_agency": 8,
    "social_circulation": 7,
    "mechanical_integrity": 8,
    "report_confidence": 8
  }
}