{
  "role": "adversarial",
  "verdict": "The simulation fails to maintain the locked design balance, resulting in a dominant 'human_mantle' strategy and speculative voting. While social circulation and character agency remain robust, 100% of agents cast identity ballots on incomplete evidence chains, and one-human endings are structurally neglected.",
  "findings": [
    "Dominant Strategy and Structural Imbalance: The complete lack of votes (0/16) for 'one_human' alongside an overwhelming majority (11/16) for 'human_mantle' reveals a severe structural imbalance, violating the design intent of equal weighting among primary identities.",
    "Systemic Evidence Deficiency: Every single agent (100%) submitted final identity ballots with 'full_evidence_chain' set to false, indicating that the simulation's mechanical constraints allow or force speculative voting based on incomplete information.",
    "Unsupported Complex Conclusions: Multiple characters voted for the 'progressive' identity (C10, C13, C15) despite missing almost all critical progression evidence dimensions, showcasing that the extra difficulty of this path was bypassed by agent speculation.",
    "Premature Article Certainty: Character C12 breaches the locked design intent of article ambiguity by asserting absolute public denials of the article's existence ('No complete article exists' / 'No complete article ever existed') across all three sections.",
    "Cognitive-Behavioral Dissonance: The aggregate belief metric for 'vale_killed_by_ai' stands at a prominent 29.4% in Section 3, yet only 2 characters cast final ballots reflecting this fate, exposing a clear disconnect between tracked belief values and final decision logic.",
    "Socio-Temporal Belief Decay: Aggregate belief in 'one_human' steadily decayed from 28.4% (Section 1) to 19.7% (Section 3), while 'human_mantle' rose from 30.0% to 36.9%, illustrating a social feedback loop artifact that erodes simpler hypotheses over time."
  ],
  "evidence": [
    "r_identity aggregate ballots: human_mantle: 11, synthetic_origin: 2, progressive: 3, one_human: 0.",
    "100% of identity_ballot_support records show full_evidence_chain: false.",
    "C10, C13, and C15 progressive ballots show missing dimensions: 'shared_human_production', 'transition', and 'later_system_control' are uncited.",
    "C12 public statements in Sections 1, 2, and 3: 'No complete article exists' and 'No complete article ever existed'.",
    "Belief means by section for 'one_human' decay: 28.4 (Sec 1) -> 24.1 (Sec 2) -> 19.7 (Sec 3).",
    "Belief means by section for 'human_mantle' rise: 30.0 (Sec 1) -> 33.4 (Sec 2) -> 36.9 (Sec 3).",
    "Aggregate vale_fate ballots show 10 votes for voluntarily_vanished and only 2 votes for killed_by_ai, despite a 29.4% belief mean for 'vale_killed_by_ai' in Section 3."
  ],
  "failure_modes": [
    "Dominant Strategy Convergence: A lack of support or structural cues for the 'one_human' path led to total neglect of a primary intended outcome.",
    "Speculative Balloting: Allowing agents to submit final selections on topics for which they have incomplete evidence chains leads to low-integrity conclusions.",
    "Ambiguity Breach: Absolute public declarations by C12 resolved a locked mystery element ('article existence') prematurely.",
    "Metric Dissonance: The tracked belief scores do not align with or accurately predict character ballot choices, making belief tracking a misleading metric."
  ],
  "recommendations": [
    "Rebalance the fact repository and clue distribution to ensure the 'one_human' path has equal weight and is highly viable.",
    "Prevent speculative voting by introducing a hard validation rule that requires a complete evidence chain or a minimum threshold of cited dimensions to select a ballot option.",
    "Refine the system prompts of short-seller/skeptic characters like C12 to express doubt rather than declarative certainty regarding the article's existence.",
    "Recalibrate belief metric aggregation formulas to better weigh dialogue commitments, or align ballot logic directly with internal belief states."
  ],
  "scores": {
    "primary_ending_balance": 2,
    "progressive_difficulty": 4,
    "article_ambiguity": 5,
    "character_agency": 7,
    "social_circulation": 8,
    "mechanical_integrity": 4,
    "report_confidence": 10
  }
}