{"role":"agency","verdict":"Strong character-level agency and broad participation, with meaningful bargains, voluntary disclosure, and viable goal success outside the dominant R theory. The main weakness is ending convergence: Progressive became the default reconstruction despite failing its decisive causal threshold, while the three primary identity endings did not retain equal practical weight. This is a single compressed simulation and is not statistically robust.","findings":["Game design: Quiet and peripheral roles had consequential, distinct goals. C09 resolved the debt through forgiveness and privacy terms; C10 separated personal accountability from identification; C16 converted neighborhood knowledge into governance and protections; and C07 secured worker-controlled remedies (Sections 1–3).","Game design: Characters could succeed while wrong about R. C03 and C09 voted Human Mantle while completing their stewardship, custody, forgiveness, and privacy goals; C01, C07, C11, and C16 achieved institutional or community goals without needing any R ending authenticated (Section 3).","Game design: Choices generally involved real tradeoffs. C03 transferred O02 into protected custody; C04 weakened personal succession legitimacy to obtain conditional stewardship; C05 chose institutional disclosure over containment; C12 admitted profitable amplification; and C14 rejected a purchased conclusion (Section 3).","Game design: The app/message structure successfully generated face-to-face exchanges. Every character pursued requests through named interlocutors, and evidence circulated across technical, institutional, labor, neighborhood, journalistic, and investigative groups rather than remaining inside isolated messages (Sections 1–3).","Game design: No single object or holder authenticated an ending. O01, O03, O04, O05a–c, O07a–b, O08, O09, and O10a were repeatedly bounded by provenance or interpretation limits, and transfers of O02 and O07a were voluntary (Section 3, C02–C06 and C11–C14).","Game design: Progressive remained mechanically harder in the formal gate: all three public keys existed, but zero AI-death votes meant the ending was ineligible despite 14 Progressive identity votes. This preserves the separate Vale-incident requirement at the rules level.","Game design: Equal structural weight did not translate into equal persuasive viability. Progressive rose from a mean belief of 29.4 in Section 1 to 44.2 in Section 3 and received 14 of 16 ballots; Synthetic Origin received no final ballots, One Human received none, and Human Mantle only two.","Agent/prompt artifact: Section 3 shows near-universal key claiming rather than discriminating key evaluation. Fourteen characters claimed all three Progressive keys even while explicitly saying autonomous control and Vale’s fate were unproved; C03 alone claimed only identity history. This looks like completion-template pressure more than organic inference.","Agent/prompt artifact: Several agents equated 'evidence relevant to a key' with 'key satisfied.' C01, C02, C04–C16 claimed the Vale-incident key while consistently voting insufficient evidence on fate, and many claimed autonomous control while stressing that remote operators, cloned automation, remapping, or falsified logs remained possible (Section 3).","Game design: The article remained uncertain and socially useful without becoming a mandatory objective. Mean belief in existence fell from 23.8 to 14.1, while C07, C11, and C12 still achieved labor, oversight, and market-accountability goals independent of confirming it (Sections 1–3).","Potential chokepoint: C06 became the principal technical interpreter for autonomy, while C13 and C14 dominated the Vale-route interpretation. Other characters retained agency through bargaining, but Progressive evaluation repeatedly routed through this small expert cluster (Sections 2–3).","Potential compression artifact: Commitments were accepted and institutionalized unusually smoothly. Complex funding, worker governance, independent review, neighborhood representation, and witness protections converged without visible refusal, renegotiation failure, or resource conflict, reducing the felt risk of choosing among bargains (Sections 2–3)."],"evidence":["Aggregate: Progressive received 14/16 R-identity ballots; Human Mantle received 2/16; One Human and Synthetic Origin received none.","Aggregate: Progressive mean belief increased 29.4 → 33.8 → 44.2, while One Human fell 23.1 → 17.9 → 11.8 and Synthetic Origin fell 17.2 → 16.7 → 14.1.","Aggregate: the Progressive gate had identity_history=true, autonomous_control=true, and vale_incident=true, but ai_death_votes=0, so eligible=false.","Section 3, C03: transferred O02 voluntarily to C07, supported guarded stewardship, voted Human Mantle, and claimed only identity_history.","Section 3, C09: completed forgiveness and protected review goals, voted Human Mantle, and kept identity, autonomy, and Vale claims separate.","Section 3, C04: obtained conditional stewardship only after disclosing the compromised succession setup and accepting collective safeguards.","Section 3, C05 and C11: disclosed matched authorization/calendar records and accepted independent review without claiming those records identified R or Vale’s fate.","Section 3, C06: stated that alternate access, external feeds, cloned automation, credential remapping, and falsified logs remained viable, despite claiming autonomous_control.","Section 3, C13, C14, and C16: preserved the manufactured-route defect, unidentified service-exit user, and unverified post-intervention endpoint.","Sections 1–3, C07 and C16: converted protected worker and neighborhood information into representation, nonretaliation, governance, and bounded disclosure rather than forced testimony.","Section 3, C12: admitted amplification and profit but withheld article authentication; aggregate article belief ended at 14.1.","Section 3 ballots: all 16 chose insufficient evidence for Vale’s fate, demonstrating that the identity consensus did not automatically authenticate the prohibited Progressive ending."],"failure_modes":["Progressive can become a semantic umbrella for any mixed human-and-technical history, crowding out Human Mantle and Synthetic Origin without meeting the stricter causal burden.","Key checklists can reward mentioning three evidence tracks rather than proving their ordered connection, producing nominal completion without substantive satisfaction.","Expert chokepoints around C06 for technical control and C13/C14 for Vale can make other characters’ ending judgments derivative even when their personal goals remain active.","Compressed agents may accept reciprocal protections and institutional reforms too readily, making bargains meaningful in content but low-risk in execution.","The absence of final One Human or Synthetic Origin support suggests those endings lacked equally compelling advocates, coalition rewards, or late evidence routes in this run.","Because all Vale-fate ballots were insufficient evidence, the harder Progressive ending was protected mechanically but may have been practically unreachable rather than merely difficult."],"recommendations":["Separate 'evidence discussed' from 'key satisfied' in the ballot prompt; require a short cited justification for each claimed Progressive key and allow 'examined but unproved.'","Require the Progressive identity vote itself to depend on ordered linkage among origin, mantle transition, and later control, not merely the presence of all three themes.","Give One Human, Human Mantle, and Synthetic Origin comparably actionable coalition payoffs and late-stage evidence opportunities without authenticating any of them.","Distribute autonomy and Vale evidence across additional quiet roles so C06 and C13/C14 are important but not required interpreters.","Introduce at least one credible refusal, incompatible demand, or resource constraint in institutional bargains so protections and governance require prioritization.","Preserve the current voluntary object and testimony rules; the O02 and O07a transfers demonstrate that voluntary custody can create consequential action without forced transfer.","Keep the article ambiguity and identity-neutral side goals; they allowed C03, C07, C09, C11, C12, and C16 to succeed without resolving R.","Test additional simulations before drawing balance conclusions; this transcript supports design concerns but not statistical claims."],"scores":{"primary_ending_balance":2,"progressive_difficulty":4,"article_ambiguity":5,"character_agency":5,"social_circulation":5,"mechanical_integrity":4,"report_confidence":4}}