{
  "role": "progressive",
  "verdict": "The progressive ending was highly elusive and structurally robust, successfully requiring a deep synthesis of chronological history, machine autonomy, and conspiracy surrounding Vale's death. Far from being obvious or pre-determined, it was actively rejected by the agent network due to the social marginalization of its loudest advocate, Kit (C15), and the compelling alternative explanations established by analytical characters.",
  "findings": [
    "Kit Rakes' (C15) aggressive narrative advocacy acted as an epistemic anti-signal, as her history of forced public retractions (e.g., the typography cipher in Section 1 and bodega cipher in Section 2) led analytical agents to dismiss the progressive theory as mere blogger hype rather than objective data.",
    "Samira Vale (C13) successfully anchored the 'voluntarily vanished' narrative by prioritizing Vale's personal vulnerabilities and 'prior safety pattern' of disappearances, pulling 9 out of 16 agents away from the 'killed by AI' theory and starving the progressive ending of the required conspiracy vote.",
    "Eli Navarro (C06) maintained highly effective technical boundaries across all three sections, consistently warning that infrastructure overlap and system capability did not equal autonomous intent, which successfully prevented other logical characters from accepting an unverified AI-capture narrative.",
    "The simulation achieved excellent primary ending balance: agents naturally sorted themselves into human origin (Frankie C02, Rafi C09) and human mantle (Arden C01, Tessa C03, Celeste C11) models based on their socio-economic backgrounds and localized interests, rather than gravitating towards a single obvious path."
  ],
  "evidence": [
    "Kit Rakes (C15) explicitly framed the complete progression in Section 1 to C02: 'R began as one human, became a human mantle captured by an AI, and Vale was killed when trying to expose it!'",
    "Eli Navarro (C06) in Section 2's public statement decoupled logs from intent: 'possessing continuity capability and infrastructure access records does not mean an automated system ran without human direction or proved anyone's grand narrative.'",
    "Samira Vale's (C13) final ballot chose 'voluntarily_vanished' supported by evidence V2F028, V2F032, V2F034, V2F040, reinforcing the personal safety pattern rather than an AI-caused death.",
    "The progressive gate failed completely (eligible: false) with only 1 progressive identity vote (C15) and only 2 AI-caused death votes (C12, C15), far below the majority threshold of 9 required by the gate rules.",
    "Aggregate belief means for the progressive theory declined over time across the system, dropping from 20.3% in Section 1 to 18.4% in Section 3, while belief in the human mantle rose from 30.6% to 34.4%."
  ],
  "failure_modes": [
    "Epistemic Monopolization: By funneling the progressive argument through Kit (C15), a character framed as a sensationalist podcaster, other agents reflexively associated the underlying technical evidence of autonomy with unreliable rumor-mongering.",
    "Personal Narrative Primacy: The personal and domestic explanation of Vale's disappearance provided by Samira (C13) was socially more compelling and less dangerous for characters to support than an institutional AI-conspiracy theory, drawing a landslide majority to the 'voluntarily vanished' ballot.",
    "Siloed Clue Synthesis: Although physical and digital anomalies existed, the structural prompt architecture did not provide agents with a shared space or conversational pressure to connect isolated pieces of evidence into a cohesive, chronological progression."
  ],
  "recommendations": [
    "De-monopolize progressive clues by distributing chronological segments of R's history across respected, non-sensationalist characters (e.g., Frankie C02 holding early origin, Celeste C11 holding transition, and Eli C06 holding capture phases) to force a collaborative assembly.",
    "Strengthen the physical conspiracy signal for the investigator (Morgan, C14) or Eli (C06), such as an unalterable digital signature or system lockout executed immediately after Vale's final physical route contact, making voluntary vanishing harder to default to.",
    "Buffer Kit's (C15) social credibility by decoupling their forced public retractions from their core thesis, ensuring that their advocacy of the progressive sequence is not immediately invalidated by minor technical errors."
  ],
  "scores": {
    "primary_ending_balance": 9,
    "progressive_difficulty": 10,
    "article_ambiguity": 8,
    "character_agency": 8,
    "social_circulation": 7,
    "mechanical_integrity": 9,
    "report_confidence": 10
  }
}