{
  "role": "mystery",
  "verdict": "The simulation successfully maintains the core ambiguity of the article's existence and exhibits high character agency and social circulation of objects, but suffers from severe premature convergence on the 'human_mantle' identity and 'investigating_r' relationship due to asymmetric evidentiary distribution, prosocial agent biases, and unenforced epistemic standards.",
  "findings": [
    "Asymmetric Evidentiary Distribution (Soft Proof Leak): Highly visible public records of collective action and bodega routines (V2F004, V2F005, V2F007, V2F008, V2F041, V2F042) structurally favor 'human_mantle' over other origins.",
    "Premature Convergence via Incomplete Evidence Chains: 100% of characters (16/16) cast ballots with incomplete evidence chains (full_evidence_chain: false). All 9 'human_mantle' voters failed to cite the required 'identity_authority' dimension.",
    "Imbalance in Ending Affirmation: The primary endings lack equal structural weight. 'human_mantle' heavily dominates the final ballots (9 votes), while 'one_human' and 'synthetic_origin' are marginalized (2 votes each).",
    "Agent Goal-Blending and Social Bias: Agents let political and social objectives (e.g., worker protections, local funding, debt settlement) bias their investigative conclusions, naturally steering them toward the collaborative 'human_mantle' narrative.",
    "Universal Vale Convergence: The 'vale_relationship' option 'investigating_r' received 100% of the votes (16/16), indicating a complete lack of viable alternative hypotheses or strong fact-induced bias.",
    "Preservation of Article Ambiguity: The locked design intent of keeping the article's existence and fate uncertain was successfully maintained. No complete manuscript was produced, and market actions were decoupled from proof.",
    "Successful Voluntary Agency: Object transfers (O01, O02, O03, O04, O05) and information exchanges were entirely voluntary and negotiated face-to-face, preserving the lack of forced truth or police authority."
  ],
  "evidence": [
    "Aggregate ballots list 'r_identity' as: human_mantle (9), one_human (2), synthetic_origin (2), progressive (3).",
    "Aggregate 'identity_ballot_support' shows 'full_evidence_chain': false for all 16 characters (C01-C16).",
    "Aggregate lists 'identity_authority' as an uncited evidence dimension for all 9 characters selecting 'human_mantle' (C01, C03, C04, C07, C08, C09, C10, C14, C16).",
    "Section 3 ballots show universal convergence on 'vale_relationship': 'investigating_r' (16/16).",
    "Section 1 & 2 transcript shows C16 (Inez), C07 (Maren), and C03 (Tessa) forming an active protective coalition for contributors (V2F041, V2F042) before casting human_mantle ballots.",
    "Section 3 transcript shows Rafi (C09) agreeing to a decentralized ledger interpretation with Graham (C12) in exchange for debt settlement, illustrating transactional truth negotiation.",
    "Section 3, C14 (Morgan Shaw) public statement admits that a route segment was generated from a withdrawn template (V2F025, V2F027), preserving the unresolved uncertainty of Vale's fate."
  ],
  "failure_modes": [
    "Unenforced Epistemic Prerequisites: The simulation engine allowed characters to vote for complex endings (like progressive or human_mantle) without possessing or citing facts that satisfy all necessary evidentiary dimensions.",
    "Evidentiary Asymmetry: The public fact pool contains highly descriptive collective labor and service routine details, creating a path of least resistance toward 'human_mantle' while leaving 'one_human' and 'synthetic_origin' under-supported.",
    "Goal-Blended Reasoning: Agents blended distinct commercial and political interests with forensic truth, treating a mystery ballot as a vehicle for solidarity or financial settlement rather than empirical investigation.",
    "Lack of Narrative Alternatives for Vale: Complete absence of alternative roles or relationship paths for Vale, resulting in flat 100% convergence."
  ],
  "recommendations": [
    "Epistemic Validation Constraints: Implement prompt-level constraints or validation logic that prevents characters from casting a ballot for an ending unless they can cite facts covering every dimension required by that schema.",
    "Rebalance public facts: Introduce more compelling, explicit facts in the public pool that point to 'one_human' (private continuity) and 'synthetic_origin' (pre-byline machine activity) to match the appeal of collective labor.",
    "Decouple transactions from beliefs: Instruct agents that while material/political negotiation is encouraged, their final forensic beliefs must remain decoupled from transactional compromise or debt relief.",
    "Diversify Vale relationships: Distribute facts supporting alternative theories of Vale's relationship (e.g., Vale being R, Vale faking their disappearance to escape Parallax, or Vale actively sabotage-oriented) to break the 100% convergence."
  ],
  "scores": {
    "primary_ending_balance": 3,
    "progressive_difficulty": 8,
    "article_ambiguity": 10,
    "character_agency": 8,
    "social_circulation": 9,
    "mechanical_integrity": 4,
    "report_confidence": 10
  }
}