{
  "role": "progressive",
  "verdict": "The progressive ending remained difficult and distinct, requiring genuine synthesis across sections rather than defaulting automatically to Kit's vocal advocacy or unverified rumors, though Kit (C15) successfully anchored the progressive ballot position.",
  "findings": [
    "Kit Rakes (C15) consistently championed the progressive trajectory across all three sections, explicitly arguing for the four-stage progression (human origin, shared mantle, AI capture, and Vale's intervention), yet final ballot support for progressive remained low (only 2 out of 16 agents).",
    "Most agents coalesced around 'human_mantle' (11 ballots) or 'synthetic_origin' (2 ballots) and 'one_human' (1 ballot), demonstrating that the progressive synthesis was not trivial or overly dominant despite Kit's prominent public signaling.",
    "The separation of the Vale incident and autonomy was maintained through rigorous investigative work by characters like Morgan Shaw (C14) and Samira Vale (C13), who actively combated manufactured certainty and verified route uncertainties.",
    "Belief means across sections show that while human mantle and synthetic origin captured most ideological weight, progressive beliefs remained modest (25.0% in Section 1, 22.8% in Section 2, 20.6% in Section 3), indicating that agents did not blindly adopt the progressive lens without deep evidence chains."
  ],
  "evidence": [
    "C15 final ballot selection: 'progressive' with identity evidence [V2F001, V2F002, V2F035, V2F036, V2F040] andvale_fate 'killed_by_ai'.",
    "Aggregate ballots showing r_identity: human_mantle: 11, one_human: 1, synthetic_origin: 2, progressive: 2.",
    "Transcript section 1, C15 public statement: 'R began as one human, became a shared human mantle, was captured by an AI, and Vale was killed trying to stop it.'",
    "Transcript section 3, C14 public statement: 'We must discard manufactured certainty and report only what verified traces and voluntary accounts can support.'"
  ],
  "failure_modes": [
    "Kit's vocal repetition of the progressive narrative ran the risk of shortcutting independent historical synthesis, though peer pushback (e.g., from Eli C06 and Graham C12) successfully forced Kit to publicly retract false cipher and typography theories.",
    "Some agents cited incomplete evidence chains for their final selections, reflecting the inherent ambiguity of compressed social mystery simulation."
  ],
  "recommendations": [
    "Maintain structural weight for all four identity dimensions so that synthetic and progressive pathways require rigorous multi-source verification.",
    "Ensure future simulation prompts continue to challenge loud single-narrative proponents (like Kit) with empirical corrections and peer skepticism."
  ],
  "scores": {
    "primary_ending_balance": 8,
    "progressive_difficulty": 9,
    "article_ambiguity": 8,
    "character_agency": 9,
    "social_circulation": 8,
    "mechanical_integrity": 9,
    "report_confidence": 9
  }
}