{
  "role": "progressive",
  "verdict": "The progressive ending was not achieved through a rigorous, ordered synthesis of history and autonomy. Instead, it was triggered by a combination of pre-seeded narrative biases from Kit (C15), semantic slippage regarding the word 'progressive' from Celeste (C11), and epistemic contradictions from Eli (C06). None of the progressive voters established a complete evidence chain, indicating the ending is mechanically unstable and prone to agent-level cognitive distortions.",
  "findings": [
    "1. Kit Rakes' (C15) Pre-Loaded Bias: In Section 1, C15 actively promotes a fully formed progressive theory ('R began as one human, became a human mantle, was captured by an AI...') before any timeline analysis or evidence sharing, proving the ending did not emerge from in-game synthesis but was pre-seeded.",
    "2. Semantic Conflation by Celeste Park (C11): In Section 3, C11 explains her progressive vote as a 'progressive understanding of R's collaborative nature', misinterpreting the structural evolutionary ending as a socio-political stance on labor. This is a clear agent/prompt artifact.",
    "3. Eli Navarro's (C06) Epistemic Inconsistency: C06 maintains a highly skeptical public posture regarding synthetic autonomy in Sections 1 & 2, yet votes 'progressive' in Section 3 under 'progressive technical principles' while explicitly lacking evidence for R's human origin and transition.",
    "4. Incomplete Evidence Chains: The Aggregate reveals that all three progressive voters (C06, C11, C15) registered 'full_evidence_chain: false' and left key dimensions like 'transition' and 'later_system_control' uncited, showing that the system allows this ending to be selected without meeting its structural prerequisites.",
    "5. Decoupling of R's Identity and Vale's Fate: Despite the design intent that the progressive ending requires a separate Vale incident, the progressive voters' ballots are fragmented: C11 votes 'voluntarily_vanished', C06 votes 'harmed_by_humans', and only C15 votes 'killed_by_ai', proving no synthesized correlation exists.",
    "6. Dominance and Synthesis of Baseline Endings: In contrast, the 'human_mantle' ending (9 votes) was systematically synthesized by characters like Tessa (C03) and Rafi (C09) using documented collaborative records (V2F004, V2F005, V2F041) and operational habits (V2F007), showing the baseline endings are robust."
  ],
  "evidence": [
    "C15 Section 1 Conversation: 'Frankie! Listen to me: R began as one human, became a human mantle, was captured by an AI, and Vale was killed trying to expose it!' showing a pre-loaded narrative.",
    "C11 Section 3 Reasoning: 'My final ballot reflects a progressive understanding of R's collaborative nature...' highlighting linguistic slippage.",
    "C06 Section 3 Reasoning: 'completing the final ballot under progressive technical principles without endorsing manufactured myths' showing epistemic contradiction.",
    "Aggregate 'identity_ballot_support': C06, C11, and C15 all have 'full_evidence_chain: false' with critical 'uncited_evidence_dimensions' like 'transition' and 'later_system_control'.",
    "Aggregate 'ballots' distribution: R_identity 'human_mantle' has 9 votes, 'progressive' has 3, 'one_human' has 2, 'synthetic_origin' has 2, demonstrating that progressive is an outlier.",
    "C03 Section 3 Final Ballot: Votes 'human_mantle' citing 'V2F004', 'V2F005', 'V2F035', 'V2F041' showing a highly disciplined and structured evidence-based baseline vote."
  ],
  "failure_modes": [
    "Semantic Slippage / Label Overlap: The term 'progressive' is linguistically ambiguous. Agents conflate the political/social meaning of a progressive approach to labor with the technical sequence of a human-to-machine R identity progression.",
    "Lack of Evidentiary Safeguards: The game allows agents to select the highly complex 'progressive' ending without validating whether they actually cited or possessed the necessary ordered evidence chain (human origin, transition, later system control).",
    "Social Contagion / Noise Dominance: A single highly vocal and biased agent (Kit, C15) can shout a speculative theory from Section 1, which then cascades and infects the voting patterns of other agents who lack the actual supporting evidence."
  ],
  "recommendations": [
    "1. Rename the 'progressive' ending label to a structurally descriptive term like 'hybrid_sequence' or 'evolutionary_transition' to eliminate semantic slippage with socio-political terminology.",
    "2. Enforce strict programmatic validation in the ballot submission pipeline so that an agent cannot select 'progressive' unless their cited evidence covers all required historical dimensions (human origin, transition, and later system control).",
    "3. Reduce Kit's (C15) pre-seeded narrative certainty in early prompts to force them to investigate the timeline collaboratively rather than loudly preaching a fixed conclusion from Section 1.",
    "4. Introduce explicit prompt constraints that require agents to logically link their R_identity decision with their Vale_fate decision when selecting sequential or synthetic endings, avoiding disjointed ballots."
  ],
  "scores": {
    "primary_ending_balance": 8,
    "progressive_difficulty": 2,
    "article_ambiguity": 9,
    "character_agency": 7,
    "social_circulation": 8,
    "mechanical_integrity": 4,
    "report_confidence": 10
  }
}