{
  "role": "mystery",
  "verdict": "The simulation successfully preserved high uncertainty and non-authentication across endings, but exhibited a strong convergence toward 'human_mantle' in ballot support (10/16 votes), indicating that the human mantle hypothesis outpaced synthetic origin and one human despite design goals of equal structural weight.",
  "findings": [
    "Human mantle dominated final identity ballots with 10 out of 16 selections, whereas one human received 3 and synthetic origin received 2, showing a collapse of the intended equal weighting between the three primary origins.",
    "Progressive difficulty operated as intended, receiving only 1 ballot vote (C15) due to its higher ordering and separate Vale incident constraints.",
    "Vale's fate remained largely uncertain and decentralized, with 13 characters selecting 'voluntarily_vanished', preventing forced authentication or police authority endings.",
    "Character agency and voluntary object transfers (such as O01 and O04 shown by C02 and C08) were respected without forced testimony or immunity mechanisms."
  ],
  "evidence": [
    "Ballot distribution for r_identity: human_mantle (10), one_human (3), synthetic_origin (2), progressive (1) as shown in the aggregate.",
    "C01, C03, C04, C06, C07, C08, C10, C11, C14, and C16 selected human_mantle in section 3 final ballots, citing evidence dimensions such as V2F001, V2F002, V2F035, and V2F040.",
    "Vale fate ballots overwhelmingly favored 'voluntarily_vanished' (13 votes), supported by character transcripts like C13 (Samira Vale) correcting false assumptions of death or corporate murder.",
    "Object actions across sections 1-3 demonstrate voluntary showing and sharing (e.g., C02 showing O01 to C01; C04 showing O03 to C06/C13; C08 showing O04 to C04) adhering strictly to voluntary transfer rules."
  ],
  "failure_modes": [
    "Premature convergence toward the human mantle hypothesis, driven by collaborative workflow routing slips (V2F035) that disproportionately validated collective labor over synthetic origin.",
    "Imbalance in initial affirmative case retention, where synthetic origin failed to capture sufficient ballot support (only C05 and C12 selected it)."
  ],
  "recommendations": [
    "Strengthen the synthetic origin evidence chain in early section logs to prevent premature social convergence on human mantle.",
    "Ensure technical log artifacts (V2F016) carry equal weight to collaborative routing slips in shaping agent belief trajectories."
  ],
  "scores": {
    "primary_ending_balance": 6,
    "progressive_difficulty": 9,
    "article_ambiguity": 8,
    "character_agency": 9,
    "social_circulation": 8,
    "mechanical_integrity": 9,
    "report_confidence": 9
  }
}