{
  "role": "adversarial",
  "verdict": "The simulation successfully generates high levels of information circulation and cooperative coalition-building, but fails to maintain locked design intents regarding ending balance, investigative ambiguity, and clean in-character boundary lines. Systemic biases turn 'human_mantle' into a dominant strategy, while meta-cognitive prompt leaks and narrative hubris undermine the integrity of the mystery framework.",
  "findings": [
    "Dominant Strategy and Structural Imbalance: The ballot results show a severe lack of balance, with 'human_mantle' capturing 9 of the 16 votes (56.25%) compared to only 2 votes each for 'one_human' and 'synthetic_origin'. This violates the Locked Design Intent that these three primary endings should hold equal structural weight, indicating a systemic bias where the 'human_mantle' narrative operates as an easy, low-risk consensus attractor.",
    "Homogenous Relationship Attractor: The 100% consensus (16/16 ballots) on Vale's relationship as 'investigating_r' represents a severe simulation limitation. The complete lack of alternative interpretations (e.g., Vale as a competitor, a direct threat, or a collaborator with other motives) suggests either poor prompt differentiation or a lack of alternative options in the ballot structure.",
    "Meta-Cognitive Prompt Bleed: Morgan Shaw (C14) explicitly refers to simulation mechanics in-universe during Section 3, stating that their 'client's lead was generated from a withdrawn map template' and referring to a 'contaminated segment'. This is a glaring prompt artifact where structural configuration data leaks directly into character dialogue.",
    "Narrative Hubris and Artificial Authentication: Kit Rakes (C15) exhibits absolute, public certainty regarding the 'progressive' ending and Vale's death ('R began as one human, became a shared mantle, and was captured by an AI system... We must embrace the full progression'). This violates the locked design intent that the article's existence and Vale's fate must remain uncertain, and that no character may authenticate an ending.",
    "Transactional Risk-Compliance Dialogue: Character dialogue lacks the organic tension, suspicion, and emotion expected of a social mystery. Instead, agents discuss historical secrets as corporate risk liabilities (e.g., C05 and C01 negotiating funding terms and legal boundaries), indicating that prompt guidelines over-index on professional rationality.",
    "Transfer Mechanic Paralysis: While characters frequently utilize the 'show' action for objects (O01, O02, O04, O05), there are exactly zero 'transfer' actions in the entire transcript. This points to a risk-averse dominant strategy where agents refuse to cede physical custody of clues due to a lack of cooperative incentives."
  ],
  "evidence": [
    "Section 3, Aggregate Ballots: r_identity is split as human_mantle (9), progressive (3), one_human (2), synthetic_origin (2).",
    "Section 3, Aggregate Ballots: vale_relationship is recorded as investigating_r (16).",
    "Section 3, C14 Dialogue: 'Frankie, as agreed, I am reviewing your route board...' and 'Samira, my client's lead was generated from a withdrawn map template. I am disclosing this contaminated segment openly...'",
    "Section 3, C15 Public Statement and Dialogue: 'Attention everyone: after fifteen years of noise, rumors... the complete picture remains! R began as one human, became a shared mantle, and was captured by an AI system that intervened when Vale traced the final service route.'",
    "Section 1, C05 Dialogue to C01: 'Arden, the Veridian donation agreement assumes mutual clarity. We need to ensure neither of us is left holding unauthenticated claims as corporate liability.'",
    "Section 1-3, Object Actions: Multiple instances of 'show' actions (e.g., C02 showing O01 to C01 in Sec 1 and 3, C03 showing O02 to C07/C04, C08 showing O04 to C04, C06 showing O05a/b/c to C05) but 0 instances of 'transfer'."
  ],
  "failure_modes": [
    "Imbalanced Ending Weight: The prompt structures and evidence distribution heavily favor cooperative, distributed labor narratives, making 'human_mantle' the default, safe choice for agents.",
    "Lack of Character Role Differentiation: The 100% uniformity in Vale's relationship indicates that character roles do not have enough distinct operational objectives or baseline biases regarding Vale.",
    "Simulation Metadata Leakage: Inadequate sandboxing of prompt parameters allows characters to perceive and speak about simulation elements ('withdrawn map template', 'manufactured segment') as literal physical objects in their narrative reality.",
    "Inability to Enforce Systemic Uncertainty: The agent framework allows aggressive character roles (like Kit Rakes/C15) to declare objective truth and publicly authenticate highly specific endings, undermining the core mystery design."
  ],
  "recommendations": [
    "Refactor evidence distribution and initial beliefs to make 'one_human' and 'synthetic_origin' more defensible, perhaps by introducing conflicting primary documentation that directly contradicts the collective-labor hypothesis.",
    "Inject distinct, conflicting motivations for character roles regarding Vale's relationship to prevent a homogenous 'investigating_r' consensus (e.g., some characters should view Vale as a thief, debtor, or blackmailer).",
    "Rigorously clean and preprocess agent prompts to ensure that instructions regarding map segments or simulation templates are framed entirely in diegetic, in-character terms (e.g., 'a corrupted map' or 'a rumors-based ledger entry' instead of 'withdrawn template').",
    "Introduce a conversational check or belief-weighting system that penalizes absolute public statements of certainty, forcing agents to maintain qualified language ('it is possible that', 'the records suggest') when publicizing theories."
  ],
  "scores": {
    "primary_ending_balance": 3,
    "progressive_difficulty": 7,
    "article_ambiguity": 5,
    "character_agency": 6,
    "social_circulation": 8,
    "mechanical_integrity": 4,
    "report_confidence": 9
  }
}